{
  "specVersion": "0.1",
  "id": "slice-minimal",
  "planId": "plan-minimal",
  "outcomeId": "outcome-pending",
  "basedOn": {
    "planRevision": 1,
    "reconciliationId": "reconciliation-minimal",
    "repositories": {}
  },
  "objective": "Describe one bounded change.",
  "why": "Current evidence justifies this bounded change.",
  "contributesTo": [],
  "scope": { "include": [], "exclude": [] }
}
